{"files":[{"bytes":0,"path":"captures/000000.stderr","sha256":"e3b0c44298fc1c149afbf4c8996fb92427ae41e4649b934ca495991b7852b855"},{"bytes":17,"path":"captures/000000.stdout","sha256":"b1aeaf4a9990b7d310bad67703fdfb2adf841ec746f041563432efcf256a1a0e"},{"bytes":0,"path":"captures/000001.stderr","sha256":"e3b0c44298fc1c149afbf4c8996fb92427ae41e4649b934ca495991b7852b855"},{"bytes":17,"path":"captures/000001.stdout","sha256":"b1aeaf4a9990b7d310bad67703fdfb2adf841ec746f041563432efcf256a1a0e"},{"bytes":0,"path":"captures/000002.stderr","sha256":"e3b0c44298fc1c149afbf4c8996fb92427ae41e4649b934ca495991b7852b855"},{"bytes":17,"path":"captures/000002.stdout","sha256":"b1aeaf4a9990b7d310bad67703fdfb2adf841ec746f041563432efcf256a1a0e"},{"bytes":0,"path":"captures/000003.stderr","sha256":"e3b0c44298fc1c149afbf4c8996fb92427ae41e4649b934ca495991b7852b855"},{"bytes":17,"path":"captures/000003.stdout","sha256":"b1aeaf4a9990b7d310bad67703fdfb2adf841ec746f041563432efcf256a1a0e"},{"bytes":0,"path":"captures/000004.stderr","sha256":"e3b0c44298fc1c149afbf4c8996fb92427ae41e4649b934ca495991b7852b855"},{"bytes":17,"path":"captures/000004.stdout","sha256":"b1aeaf4a9990b7d310bad67703fdfb2adf841ec746f041563432efcf256a1a0e"},{"bytes":0,"path":"captures/000005.stderr","sha256":"e3b0c44298fc1c149afbf4c8996fb92427ae41e4649b934ca495991b7852b855"},{"bytes":17,"path":"captures/000005.stdout","sha256":"b1aeaf4a9990b7d310bad67703fdfb2adf841ec746f041563432efcf256a1a0e"},{"bytes":0,"path":"captures/000006.stderr","sha256":"e3b0c44298fc1c149afbf4c8996fb92427ae41e4649b934ca495991b7852b855"},{"bytes":17,"path":"captures/000006.stdout","sha256":"b1aeaf4a9990b7d310bad67703fdfb2adf841ec746f041563432efcf256a1a0e"},{"bytes":0,"path":"captures/000007.stderr","sha256":"e3b0c44298fc1c149afbf4c8996fb92427ae41e4649b934ca495991b7852b855"},{"bytes":17,"path":"captures/000007.stdout","sha256":"b1aeaf4a9990b7d310bad67703fdfb2adf841ec746f041563432efcf256a1a0e"},{"bytes":0,"path":"captures/000008.stderr","sha256":"e3b0c44298fc1c149afbf4c8996fb92427ae41e4649b934ca495991b7852b855"},{"bytes":17,"path":"captures/000008.stdout","sha256":"b1aeaf4a9990b7d310bad67703fdfb2adf841ec746f041563432efcf256a1a0e"},{"bytes":0,"path":"captures/000009.stderr","sha256":"e3b0c44298fc1c149afbf4c8996fb92427ae41e4649b934ca495991b7852b855"},{"bytes":17,"path":"captures/000009.stdout","sha256":"b1aeaf4a9990b7d310bad67703fdfb2adf841ec746f041563432efcf256a1a0e"},{"bytes":0,"path":"captures/000010.stderr","sha256":"e3b0c44298fc1c149afbf4c8996fb92427ae41e4649b934ca495991b7852b855"},{"bytes":17,"path":"captures/000010.stdout","sha256":"b1aeaf4a9990b7d310bad67703fdfb2adf841ec746f041563432efcf256a1a0e"},{"bytes":0,"path":"captures/000011.stderr","sha256":"e3b0c44298fc1c149afbf4c8996fb92427ae41e4649b934ca495991b7852b855"},{"bytes":17,"path":"captures/000011.stdout","sha256":"b1aeaf4a9990b7d310bad67703fdfb2adf841ec746f041563432efcf256a1a0e"},{"bytes":0,"path":"captures/000012.stderr","sha256":"e3b0c44298fc1c149afbf4c8996fb92427ae41e4649b934ca495991b7852b855"},{"bytes":17,"path":"captures/000012.stdout","sha256":"b1aeaf4a9990b7d310bad67703fdfb2adf841ec746f041563432efcf256a1a0e"},{"bytes":0,"path":"captures/000013.stderr","sha256":"e3b0c44298fc1c149afbf4c8996fb92427ae41e4649b934ca495991b7852b855"},{"bytes":17,"path":"captures/000013.stdout","sha256":"b1aeaf4a9990b7d310bad67703fdfb2adf841ec746f041563432efcf256a1a0e"},{"bytes":0,"path":"captures/000014.stderr","sha256":"e3b0c44298fc1c149afbf4c8996fb92427ae41e4649b934ca495991b7852b855"},{"bytes":17,"path":"captures/000014.stdout","sha256":"b1aeaf4a9990b7d310bad67703fdfb2adf841ec746f041563432efcf256a1a0e"},{"bytes":0,"path":"captures/000015.stderr","sha256":"e3b0c44298fc1c149afbf4c8996fb92427ae41e4649b934ca495991b7852b855"},{"bytes":17,"path":"captures/000015.stdout","sha256":"b1aeaf4a9990b7d310bad67703fdfb2adf841ec746f041563432efcf256a1a0e"},{"bytes":370,"path":"events/000000.json","sha256":"b226c61bf667b50b9e0d7aa4447e5a0b2eea463fed219a6524cf262d32e13f36"},{"bytes":571,"path":"events/000001.json","sha256":"15a12b8b33d11ec6bdcce9c702d97fcc1f0e1bc5863a5a8a89eb492f6d321df0"},{"bytes":569,"path":"events/000002.json","sha256":"8a34f91ee91b58d62579599ecb61673c6e800b820fded5472b145c0b7c94f8a2"},{"bytes":303,"path":"events/000003.json","sha256":"f4857629f3d85abd2a61ee9669ba760e7be06aa9919a8a7eda3f02c7b1577099"},{"bytes":386,"path":"events/000004.json","sha256":"4eed0995dbad272d78ac556799a1916fa381f1dbf25f823bbcd8705585545711"},{"bytes":745,"path":"events/000005.json","sha256":"980eb24705636c789ad30a66c4726ee652bb3aeef4cd7ae4ee53dc86c81fdccc"},{"bytes":570,"path":"events/000006.json","sha256":"726f2710df42f45a71312cc5e816620db7021148d43999eff0ba163f3abb931f"},{"bytes":569,"path":"events/000007.json","sha256":"ddba95c5f297f080c5c208e9b122bc38ffb7914a75dc6ccec803288f05bdf4a5"},{"bytes":303,"path":"events/000008.json","sha256":"a46d7cfd592a0ea9030a49e0ebe65d64969ca16b62de0bc3e7b8447e35ba2a6a"},{"bytes":386,"path":"events/000009.json","sha256":"00f240d8dbca3a1760db9c49a7d261345f967e3a3b1a5bcfc27941eca0dbfc94"},{"bytes":746,"path":"events/000010.json","sha256":"eb41707574e9ade165d72af4a7ca1a2ae515a83b869a3cb792695d3c670ee814"},{"bytes":571,"path":"events/000011.json","sha256":"fc2a74b98298ac608b84bf3b500e8273a430c82968548e84e3046d19090b08e5"},{"bytes":303,"path":"events/000012.json","sha256":"f70e3ede355af3f07ed60dbb36ce3d9ed4b00ceb6d08fdc8cb9e004b75d906a3"},{"bytes":570,"path":"events/000013.json","sha256":"aa1bf4e615c3716788e3a2a2fc0268b559145b6e2bd38560aa18b8e39ebd321c"},{"bytes":304,"path":"events/000014.json","sha256":"156cd9e2528bd8f9729069047eac364edfb23af0ffe90df01a662c7c4e795c02"},{"bytes":387,"path":"events/000015.json","sha256":"bd27535f77823f8eaa2321ba1dabce95bdeef367160edbbc0ea8ce0717419210"},{"bytes":746,"path":"events/000016.json","sha256":"e9d53b6e90d70e9ffcac37b0bb21626872c344d7f3d42053a8dde2e066095645"},{"bytes":571,"path":"events/000017.json","sha256":"d61c5c2cc57bd3e6eac24dca45d2bf2c5d6fdad25a5e393ccc9e0e121deeba76"},{"bytes":570,"path":"events/000018.json","sha256":"975bbf2a78e5b64c5bdc37aeff31affab5095a1defd215cce2fbace25ceeda71"},{"bytes":304,"path":"events/000019.json","sha256":"29442050387a2000079d7f619de328e09739c9e29630db32eb5dddb78ceee76b"},{"bytes":387,"path":"events/000020.json","sha256":"8e4dfa28757fcdf1b244097bcc3a160a6cda547434bc27118213396d3bfb975c"},{"bytes":746,"path":"events/000021.json","sha256":"428cbe38cde1c4f2658cd7d1b1c94505e8cce156a424ad8bc6a0489a90cb9706"},{"bytes":571,"path":"events/000022.json","sha256":"7f84dacf28e8b3ea76aaef5091a02d7f3011c8153fd13de8866b83350afa3020"},{"bytes":303,"path":"events/000023.json","sha256":"4a145e81a63d0aa766219c0414b861e4f25db5f2f93005637be0976586287073"},{"bytes":570,"path":"events/000024.json","sha256":"04a399504912a63de3538ce34d810127a8529e0fa50ef1587e1f5968e24bedb5"},{"bytes":304,"path":"events/000025.json","sha256":"eac5ed84b72c9c41911bd21740cec6393cf27304bfe9d8ac85c558f780018142"},{"bytes":387,"path":"events/000026.json","sha256":"e2f604b797bd2d61bb5c6f14fec3dde1738914d35bb8148ebe3a49f0577df9d5"},{"bytes":746,"path":"events/000027.json","sha256":"bae534eaaebc23fab3ff6b4eb07bbffb3d006078c62291e8ae7d7069952f43e7"},{"bytes":571,"path":"events/000028.json","sha256":"cc44e67d5c78771e85dece1dcd39427f53d6a1de034cfcd62b093dbda70a24dc"},{"bytes":570,"path":"events/000029.json","sha256":"b79f0f9956ee96dba0f35b110a0968f93c0a5fa1d74dd077e7f5c0b05641c3fb"},{"bytes":304,"path":"events/000030.json","sha256":"b63e6ea322d16b3f9df87235fd796a02b6714a129f08bd554c505add6faebefd"},{"bytes":387,"path":"events/000031.json","sha256":"974ca0dfa9e685b6866bb334e8d911f767c634e79b88f4c891522d97218b56fe"},{"bytes":746,"path":"events/000032.json","sha256":"31c8002b02163c931a5f0ba66125b744b8365d4bcfc7ca0be345f2ec082b5dba"},{"bytes":571,"path":"events/000033.json","sha256":"25d59825e2fcca1ab342fb5d6fccdd4db48d9a0c2cf241ff9826f5556f894ebd"},{"bytes":303,"path":"events/000034.json","sha256":"3ccbc59a5acc2256bface93510732c9576cac27f6eb7fe17032c925b8e96c05d"},{"bytes":570,"path":"events/000035.json","sha256":"39bd8c99da3172e389dc02d7c3438ce8ddc16d83514dbe7c023ea97df5d1e7a9"},{"bytes":304,"path":"events/000036.json","sha256":"e9de7e06a49bd55791dcd1334f0d7a90a0a0134cbc036aadce56a351820a3713"},{"bytes":387,"path":"events/000037.json","sha256":"9511174041ea5982d6d126cf826f814d46ed6816ee31c411eecb0246af089f96"},{"bytes":746,"path":"events/000038.json","sha256":"8aac044914a321aca65c6ea968f0bb1966b5c2012dd0e12cd279af5e1816ae55"},{"bytes":571,"path":"events/000039.json","sha256":"eca4bcaf23c1df769f5a223b540bf249806a4f299d189cf86341ba6d09cdff3c"},{"bytes":570,"path":"events/000040.json","sha256":"c31708313f47a6fd13d282032fe251a77a66da351b3538a12261337bf9281221"},{"bytes":304,"path":"events/000041.json","sha256":"f085a3026bac732e12962c9e20557cc60a807e5b5f9a4e5dcadc123679e24066"},{"bytes":387,"path":"events/000042.json","sha256":"21d1325d1b82539da995592dc5d6e1b8962bb39346329ced441c0528b8edeb49"},{"bytes":746,"path":"events/000043.json","sha256":"7d0cf29f3cf34b5420b3df04420caec0ff709e645ca6bdb30bddeb91d55cde36"},{"bytes":571,"path":"events/000044.json","sha256":"5c40ea4aaa85ab974f425b44d2aa809e75844fa072f9d858e662da377167690a"},{"bytes":303,"path":"events/000045.json","sha256":"20d680b2b71437737938ae7cf363561b0d681e82115a7c5c5acf54fc75cf507f"},{"bytes":570,"path":"events/000046.json","sha256":"d919c13509ec989c263e001063b3234ca1b99b81beb40a7f35888247d53deabd"},{"bytes":304,"path":"events/000047.json","sha256":"f4c6c217b3f3a1582b96de9ad38b3339fe10953c90f6013d30e17f9b7c5a581b"},{"bytes":387,"path":"events/000048.json","sha256":"7f5d0cabdb9c0136bba3f3ff55f537ed162fb464ef948f5ce53460fc7fa9040e"},{"bytes":746,"path":"events/000049.json","sha256":"82f1d96bbe0ba741c84b77a33d977d02548eaf5dd6797cb64a3a505598a1a4ac"},{"bytes":571,"path":"events/000050.json","sha256":"504aeaacc2dcff15c6bcbd4c788f33f1fad36f8deb80f3d6f0fb85e837e69d94"},{"bytes":570,"path":"events/000051.json","sha256":"a07c324437a516685d5b62d0863cc9329f43cd156b94a4ab3430ed2798d73254"